Year	Author Names	Conference
2012	พระสยามAggressiveFighting;Apple;Apple;บริษัท สวิส;ธปท.;อินชอน;กรีซ;สหภาพยุโรป;อียู;กรีซ;สหภาพยุโรป;กรีซ;บริษัทอีสต์ เอเชียติก;ประเทศไทย;อาเซียน;ธปท.;อาเซียน;AEC;แมสซาชูเซตส์;พรรครีพับลิกัน;ศูนย์พยากรณ์เศรษฐกิจและธุรกิจ;ม.หอการค้าไทย;สหภาพยุโรป;โฮจิมินห์ซิตี้;พระสยามEssential;กูเกิล;กูเกิล;กูเกิล;กูเกิล;กูเกิล;กูเกิล;พีซี;สยามสแควร์;แอพพลิเคชั่น;ซูเปอร์;ธุรกิจขนาดย่อม;สหภาพยุโรป;กองทุนการเงินระหว่างประเทศ;เอสแอนด์พี;สหภาพแรงงาน;พรรคประชาธิปไตย;องค์การเพื่อความร่วมมือทางเศรษฐกิจและการพัฒนา;OECD;OECD;OECD;อาเซียน	ORG
2013	พระสยาม1;ธนาคารพาณิชย์ไทย;ธนาคารแห่งประเทศไทย;อินโฟกราฟิกส์;สำนักยุทธศาสตร์และการวางแผนเศรษฐกิจมหภาค;สำนักงานคณะกรรมการพัฒนาการเศรษฐกิจและสังคมแห่งชาติ;กระทรวงกลาโหม;IMF;RockwellGlobal Capital;ธนาคารกลางสหรัฐฯ;FED;ก็ตามที;ซัมซุง;ฮุนได;ธนาคารแห่งประเทศไทย;ธปท.;ธปท.;ธปท.;SMEs;GDP;SMEs;สำนักงานสถิติแห่งชาติ;กรมการท่องเที่ยว;สำนักยุทธศาสตร์และการวางแผนเศรษฐกิจมหภาค;สำนักงานคณะกรรมการพัฒนาการเศรษฐกิจและสังคมแห่งชาติ;พระสยามFYIThe;ธปท.;ธปท.;Obama;กลุ่มคน Gen Y;ธปท.;ธปท.;สมเด็จพระเทพรัตนราชสุดาฯ สยามบรมราชกุมารี;โรงเรียนนายร้อยพระจุลจอมเกล้า;ธปท.;สถาบันการจัดการนานาชาติ;ซัมซุง;กองวิชาประวัติศาสตร์;โรงเรียนนายร้อยพระจุลจอมเกล้า;ธปท.;บริษัทมาสเตอร์การ์ด;มาสเตอร์การ์ด;อิสตันบูล;ดูไบ;ASIA-10;สภาอุตสาหกรรมแห่งประเทศไทย;ส.อ.ท.;องค์การการท่องเที่ยวโลก;UNWTO;สิงคโปร์;เอมิเรตส์;การบินไทย;บางกอกแอร์เวย์;แอร์เอเชีย;คาเธย์แปซิฟิก;กาตาร์แอร์เวย์”;เอทิฮัดแอร์เวย์”;กระทรวงโรงแรมและการท่องเที่ยวสสิเนสแอร์;ไทเกอร์แอร์;กระแสสังคม;Startup;The;มาดากัสการ์;สกอต;องค์การสหประชาชาติ;สหภาพยุโรป	ORG
2014	สปอร์ตส์;ทีมแมนเชสเตอร์ ยูไนเต็ด;สภาคองเกรส;คอสตาริกา;EME;สรอ.;สรอ.;สรอ.;องค์การเพื่อความร่วมมือทางเศรษฐกิจและการพัฒนา;OECD;Boutique Villas;The;กรุงรัตนโกสินทร์;สถาบันวิจัยประชากรและสังคม;ม.มหิดล;สถาบันวิจัยประชากรและสังคม;ม.มหิดล38;สำนักงานสถิติแห่งชาติ;กรมสุขภาพจิต;กระทรวงสาธารณสุข;กระทรวงสาธารณสุข;กรมส่งเสริมการส่งออก;กระทรวงพาณิชย์;ธนาคารเถื่อน;Guarantors;ธนาคารกลางจีน;PBOC;คณะกรรมการกำกับดูแลด้านธนาคารจีน;CBRC;WMPS;Trusts;WMPs;ธพ.;ธพ.;ธพ.;ธพ.;ธพ.;ธพ.;WMPs;WMPs;ธพ.;LDR;ธนาคารแห่งประเทศไทย	ORG
2016	สำนักงานภาคเหนือGuaugxiBAE;CLMV;ไทย;ธนาคารแห่งประเทศไทย;ธปท.;สหภาพเมียนมา;ธปท.;อาเซียน;ธนาคารพาณิชย์ไทย;ธปท.;สำนักงานภาคเหนือ สภน.;สหภาพเมียนมาเชียงใหม่;สหภาพเมียนมา;สหภาพ;สหภาพเมียนมา25	ORG
2017	ธปท.;คณะเศรษฐศาสตร์;มหาวิทยาลัยธรรมศาสตร์;ธนาคารแห่งประเทศไทย;ธปท.;SoftBank;สำนักงานภาคตะวันออกเฉียงเหนือ;Cambodia;Laos;เมียนมา;Vietnam;NAFTA;Workshop;สสป.ลาว;อาเซียน;สถาบันวิจัยเศรษฐกิจ;สหภาพยุโรป;สหภาพยุโรป;AACC;สหภาพยุโรป;สหภาพยุโรป;สหภาพยุโรป;Chaebol;พรรคอนุรักษ์นิยม;สภา;สหภาพยุโรป;บริษัท ปูนซิเมนต์ไทย จำกัด มหาชน;สถาบันวิจัยเพื่อการพัฒนาประเทศไทย;TDRI;สภานโยบายวิจัย;สำนักงานสถิติแห่งชาติ;คณะเศรษฐศาสตร์;มหาวิทยาลัยหอการค้าไทย;ธปท.;ธปท.;มหาวิทยาลัยเทคโนโลยีพระจอมเกล้าธนบุรี;องค์การสหประชาชาติ;KAYAK	ORG
2018	บริษัท Foxconn;Apple;แบงก์ชาติ;ธปท.;สำนักงานรัฐบาลอิเล็กทรอนิกส์;องค์การมหาชน;BREXIT;เมืองไทย;ธปท.;ธปท.;สำนักพิมพ์ openbooksสแกน;AgTech;FairtradeFoundation;AgTech;AgricultureTechnology;Uber;องค์การเพื่อความร่วมมือและการพัฒนาทางเศรษฐกิจ;OECD	ORG
2019	ธปท.;สภาหอการค้าแห่ง;สมาพันธ์เอสเอ็มอีไทย;บริษัทสหรัฐฯ;บริษัทสหรัฐฯ;WeChat;กองบรรรณาธิการอาร์ม;คณะนิติศาสตร์จุฬาลงกรณ์มหาวิทยาลัย;ศูนย์วิจัยยุทธศาสตร์ไทย;สำนักงานคณะกSSมการวิจัยแห่งชาติ;คณะนิติศาสตร์;ระเบียงเศรษฐกิจพิเศษภาคตะวันออก;ธีกร;ธนาคารแห่งประเทศไทย;ธปท.;ธปท.;ธปท.;ธปท.;ModernTrade;สำนักงานถนน;ธปท.;SMEs;SMEs;ธปท.;ธปท.;ธปท.;SMEs;บริษัท Strategy613 จำกัด;ธนาคารกสิกรไทย;ธนาคารกสิกรไทย;ธนาคารไอซีบีซี;มหาวิทยาลัยออกฟอร์ด;มหาวิทยาลัยเคมบริ;บริษัท Strategy613 จำกัด;INSPIRATION;มูลนิธิฉางอ้าย;องค์กรต่อต้านคอร์รัปชั่น;องค์กรต่อต้านคอร์รัปชัน;สำนักงานคณะกรรมการป้องกันและปราบปรามการทุจริตแห่งชาติ;ป.ป.ช.;มหาวิทยาลัยหอการค้าไทย;Global Corruption;SCB;องค์กรต่อต้านคอร์รัปชัน;SeaLimited;กระทรวงการคลัง;มหาวิทยาลัยฮาร์วาร์ด;ธนาคารเครดิตสวิส;สิงคโปร์;SeaLimited;เอเชีย;บริษัท Sea Limited42;ไทย;คณะเศรษฐศาสตร์;มหาวิทยาลัย28;กลุ่มป่าสาละBOT;บริษัทป่าสาละ จำกัด;คณะวิจัยแนวร่วมการเงินที่เป็นธรรมประเทศไทย;คุณสฤณีย์;สหประชาชาติ;กระทรวงการท่องเที่ยวและกีฬา;สำนักงานส่งเสริมการค้าในต่างประเทศ;สำนักงานนโยบายและแผนการwu;ธปท.;สำนักงานนโยบายและแผนการขนส่ง;ธปท.;อภิชญา;ธนาคารแห่งประเทศไทย;บริษัทไทย;พรรคธาดา;ธนาคารแห่งประเทศไทย;ไทย;Big Opportunityอ.;การแบ่งส่วนตลาดsegmentation;บริษัท Google Termasek;กองบรรรณาธิการแตช บุนนาค;กระทรวงการต่างประเทศ;กระทรวงการต่างประเทศ;กระทรวงการต่างประเทศ;ไทย;กองเอเชียตะวันออก;กระทรวงการต่างประเทศ;กระทรวงการต่างประเทศ;กระทรวงการต่างประเทศ	ORG
2020	ธปท.;ธปท.;ธปท.;ธนาคารแห่งประเทศไทย;ธปท.;ธปท.;ธปท.;ธปท.;ธปท.;สรอ.;ธปท.;สถานีโทรทัศน์Money Channel;ธปท.;ธปท.;องค์กรอนามัยโลก;ไทย;กรมควบคุมมลพิษ;กระทรวงทรัพยากรธรรมชาติและสิ่งแวดล้อม;กล่องโฟม;สมาคมผู้ค้าปลีกไทย;กระทรวงทรัพยากรธรรมชาติและสิ่งแวดล้อม;องค์การอนามัยโลก;องค์การอาหารและการเกษตรแห่งสหประชาชาติ;องค์การสหประชาชาติ;สำนักงานคณะกๆแต่มันสนุน;องค์การอาหารและการเกษตรแห่งสหประชาชาติ;ธนาคารโลก;สมาคมขนส่งทางอากาศระหว่างประเทศ;IATA;สรอ.;สภาอุตสาหกรรมท่องเที่ยวแห่งประเทศไทย;ข้อสมมติ;องค์การเพื่อความร่วมมือและการพัฒนาทางเศรษฐกิจ;OECD;กองทุนการเงินระหว่างประเทศ;IMF;สรอ.;WeChat;ธนาคารแห่งประเทศไทย;สหภาพยุโรป;สรอ.;โควิด 19;สรอ.;สหประชาชาติ;สรอ.;สหภาพยุโรป;สรอ.;สรอ.;สรอ.;สรอ.;สรอ.;องค์การอนามัยโลก;WHO;มหาวิทยาลัยจอห์น;ฮอปกินส์;สถานี TNN ช่อง 16;ช่อง NEW18;ธนาคารแห่งประเทศไทย;ธปท.;ปท.;ธปท.;สหภาพยุโรป;ธปท.;คณะกรรมการนโยบายการเงิน;กนง.;สถาบันการเงิน;สถานี TNN ช่อง 16;ตร.วิรไท;ธปท.;ศูนย์สร้างโอกาสเด็กพระราม;แบงก์ชาติ;สำนักงานเขตพระนคร;คลายทุกข์;สิงคโปร์;สำนักงานสถิติแห่งชาติ;ชั้นมัธยมศึกษา;คณะเศรษฐศาสตร์;มหาวิทยาลัยหอการค้าไทย;สหภาพยุโรป;สวีเดน;ภาควิชากุมารเวชศาสตร์;คณะแพทยศาสตร์;สถาบันวัคซีนแห่งชาติ;องค์การอนามัยโลก;สภากาชาดไทย;ภาควิชากุมารเวชศาสตร์;คณะแพทยศาสตร์;ภาควิชากุมารเวชศาสตร์;คณะแพทยศาสตร์;ศูนย์ฯ;แพลตฟอร์ม;Ooca;Penguin Eat Shabu;กระทรวงสาธารณสุข;ซูชิ;WORD;ซีไอเอ็มบี ไทย;ซูเปอร์มาร์เก็ต;ซูเปอร์มาร์เก็ต;องค์การการค้าโลก;กองทุนการเงินระหว่างประเทศ;International Monetary Fund:IMF;องค์กรการเงินระหว่างประเทศ;IMF;ธนาคารกลาง;ช่อง TNN16;ททบ.5;ธนาคารแห่งประเทศไทย;ธปท.;ธปท.;อุตสาหกรรมท่องเที่ยว;เศรษฐกิจไทย;TNN16;ททบ.;ธปท.;ธปท.;ธนาคารแห่งประเทศไทย;ธปท.;GDP;องค์การอนามัยโลก;กระทรวงสาธารณสุข;GDP;ธนาคารแห่งประเทศไทย;ทศพล;ธปท.;ดร.วิรไท;ประเทศไทย;การควบคุม;ธปท.;ธนาคารกลาง;ธปท.;ธปท.;ธปท.;ธปท.;กองทุนรวม;ธนาคารกลาง;ธนาคารกลาง;ธปท.;ธปท.;ธปท.;บริษัท บริหารสินทรัพย์สุขุมวิท จำกัด;SAM;คณะนิเทศศาสตร์;ช่อง TNN16;ททบ.;บุฟเฟต์;ร้านเพนกวิน อีท;ศูนย์การเรียนรู้ธนาคาร;ประกศไทย;ยพระเศรษฐกิจไทย;ธปท.;ธนาคารแห่งประเทศไทย;ธปท.;SME;ธนาคารแห่งประเทศไทย;กรุงศรี;CEO;บริษัท Transformational;บริษัท SCG Cement-Building Materials;สถานีโทรทัศน์ TNN ช่อง 16;บริษัท SCG Cement-BuildingMaterials;กรุงศรี;CEO;บริษัท Iransformational;TechCompany;INSPIRATION;ธนาคารไทยพาณิชย์;Facebook;Googleคุณธนา เธียรอัจฉริยะChief Marketing;ธนาคารไทยพาณิชย์;สามพรานโมเดล;สวนสามพราน;สวนสามพราน;สามพรานโมเดล;ZAAP PARTY;แพลตฟอร์มไทย;สถาบันการฝึกอบรมการ;ธปท.;กระทรวงแรงงาน;อว.;กระทรวงแรงงานไทย;ธนาคารแห่งประเทศไทย;กระทรวงแรงงาน;สำนักงานสภานโยบายการอุดมศึกษา;โอฬารธนาเศรษฐ์;ธนาคารแห่งประเทศไทยอาวีวรรณ;ธนาคารแห่งประเทศไทย;ธนาคารแห่งประเทศไทย;เศรษฐพุฒิ;ธุรกิจท่องเที่ยว;GDP;ธปท.;เศรษฐพุฒิ;เศรษฐพุฒิ;ธนาคารแห่งประเทศไทย;ธปท.;ธปท.;ธปท.;ธปท.;องค์กรปกครองส่วนท้องถิ่น;สภาลมหายใจเชียงใหม่;มหาวิทยาลัยเชียงใหม่;มหาวิทยาลัยเชียงใหม่;กรมอุทยานแห่งชาติ สัตว์ป่า;ไทย;ธนาคารแห่งประเทศไทย;ธปท.;สำนักงานพัฒนารัฐบาลดิจิทัล;องค์การมหาชน;สพร.;สถาบันคุณวุฒิวิชาชีพ;ธปท.;กระทรวงแรงงานไทย;กระทรวงการอุดมศึกษา วิทยาศาสตร์ วิจัยและนวัตกรรม	ORG
