Year	Author Names	Conference
2020	ดร.วิรไท สันติประภพ;Wระสยาม MAGAZINE;คุณสุภัททกิต เจตทวีกิจ;ดร.วิรไท สันติประภพ;คุณสุภัททกิต;คุณสุภัททกิต เจตทวีกิจ;ธนิดา ลอเสรีวานิช;Antheleme Brillat-Savarin;ตร.เสาวณี จันทะ;นายทศพล;สรอ.;คุณสินีนาท สวัสดิ์พูน;ดร.วิรไท สันติประภw;คุณสินีนาท สวัสดิ์พูน;ขุนพรหมปันสุข;รานสปาน;ครูเชาว์;ขุนพรหมปันสุข;คุณเกรียงไกร;ผศ.ดร.ศศิวิมล วรุณศิริ ปวีณวัฒน์;ศ. นพ.ยง ภู่วรวรรณ;พระสยาม MAGAZINE;ศาสตราจารย์นายแพทย์ยง ภู่วรวรรณ;ศาสตราจารย์ นายแพทย์ยง ภู่วรวรรณ;BOT Wระสยาม;Albert Helin;สรอ.;พระสยาม MAGAZINE;คุณพลวัชร ภู่พิพัฒน์;ดร.วิรไท สันติประภw;คุณพลวัชร ภูพิพัฒน์;วิรไท สันติประภพ;ตร.เสาวณี จันทะ;คุณพลวัชร;คุณพลวัชร ภู่พิพัฒน์;เพนกวิน อีท;คุณธนพันธ์ วงศ์ชินศรี;คุณต้น - ธนพันธ์ วงศ์ชินศรี;ดร.พงศ์ศักดิ์ เหลืองอร่าม;ดร.กฤษฎีเลิศ สัมพันธารักษ์;ดร.อาชว์ ปวีณวัฒน์;คุณชัยธัช จิโรภาส;คุณทศพล อภัยทาน;ดร.สันติธาร เสถียรไทย;ดร.วิรไท สันติประภพ;คุณฐากร ปิยะพันธ์;คุณอริยะ พนมยงค์;คุณอภิรัตน์ หอมชะเอม;คุณมนต์ชัย วงษ์กิตติไกร;คุณอภิรัตน์ หอมชะเอม;คุณฐากร ปิยะพันธ์;คุณอริยะ พนมยงค์;คุณมนต์ชัย วงษ์กิตติไกร;คุณธนา เธียรอัจฉริยะ;คุณโอ - อรุษ นวราช;คุณอรุษ;คุณอรุษ;คุณอรุษ;คุณอรุษ นวราช;คุณอรุษ;คุณบาส - เทพวรรณ คณินวรพันธุ์;คุณบาส - เทพวรรณคณินวรพันธุ์;กัมพล พรพัฒนไพศาลกุล;พ.อ. สุริยะ ทองเพชร;ผศ.ดร.พูลศักดิ์ โกษียาภรณ์ อินทกาญจน์พัฒนไพศาลกุล;ดร.เศรษฐพุฒิ สุทธิวาทนฤพุฒิเศรษฐพุฒิสุทธิวาทนฤพุฒิ;ดร.เศรษฐพุฒิ;กัมพลพรพัฒนไพศาลกุล	PERSON
2021	พิรญาณ์ รณภาพ;World Bank;พิรญาณ์ รณภาพ;เกริกเกียรติ พรหมมินทร์ และกุลนันท์;ดร.ปิติ;นายโดนัลด์ ทรัมป์;ดร.ปิติ;ดร.ปิติ;แอสตราเซเนกา;พระบาทสมเด็จพระเจ้าอยู่หัว;ดร.สุธีรา เตชคุณวุฒิ;ดร.ปิติ ศรีแสงนาม;ดร.ปิติ ศรีแสงนาม;ดร.ปิติ;ทรัมป์;ดร.ปิติ;ดร.ปิติ;นายโจ ไบเดน Google;ทรัมป์;...ผยง ศรีวณิช;คุณผยง ศรีวณิช;ดร.เศรษฐพุฒิ;ดร.เศรษฐพุฒิ สุทธิวาทนฤพุฒิ;ดร.เศรษฐพุฒิ;ยายศรี;คุณบัว;ยายศรี;คุณบัว;วาร์”;คุณบัว;คุณบัว;คุณยายศรี มาร์เก็ตเพลส;ยายศรี;mediaเรื่อย ๆ;คุณบัว;คุณบัว;คุณยายศรี;เก คงอาย;เสาวนีย์ คงทา;คุณยายศรี;คุณบัว;คุณบัว;นางสาวเสาวนีย์ คงกำเนิด;คุณบุญศรี นางนวล;คุณบัว;คุณผยงยังมี;คุณผยง;ในหลวงรัชกาลที่ 9;ดร.เศรษฐพุฒิคิด;ดร.วรากรณ์ สาม;สมศาสสกี;รากรณ์ สามโกเศศ;สันติประภพ;ดร.วรากรณ์;ดร.วิรไท;ดร.วรากรณ์;รศ.ดร.วรากรณ์;นย;ลุงองอาจ;นิตะโย;โสภณ ธัญญาเวชกิจ;บวรวิชญ์ จินดารักษ์;นันทนิตย์ ทองศรี;ดร.วรากรณ์ สามกิริยา กุลกลการ;พญ.ดุษฎี;วตการณ สงทนา;คณเมธ;เสมอน;ท แรงงานทเสยง;เมธระบวา ประเดนทนาเปน;เทคโนโลยเหลาน;หรอ ชาระเรวขนเลงเหนวา;เชนทกวนน;คุณเมธี;คุณเมธี;คุณแม้ว;จิรวัฒน์ ภู่งาม;อวิกา พุทธานุภาพ;วริทธิ์นันท์ ชุมประเสริฐ;นภนันท์ บุญญศาสตร์พันธุ์;คุณแม้ว;คุณแพร;คุณแพร;คุณแพร - นกนันท์ บุญญศาสตร์พันธุ์;คุณแพร;คุณแพร;คุณแพร;คุณแพร;คุณแพร;คุณแม้ว;กิริยา กุลกลการ;รศ.ดร.กิริยา กุลกลการ;ดร.เศรษฐพุฒิ;เศรษฐพุฒิ สุทธิวาทนฤพุฒิสยาม MAGAZINE สุทธิวาท;สมคิด พุทธศรี;ดร.เศรษฐพุฒิ สุทธิวาท;ก้องศักดิ์ คู่พงศกร;สนั่น อังอุบลกุล;คุณกุลยา;ก้องศักดิ์ คู่พงศกร;คุณก้องศักดิ์;คุณก้องศักดิ์;คุณก้องศักดิ์;คุณก้องศักดิ์;คุณก้องศักดิ์;คุณก้องศักดิ์;คุณก้องศักดิ์;คุณก้องศักดิ์;า ร มของธ รกจ ท า ต า การณ ด ร;ค น ม เพยม น;ทมทม นบ อน ค;เ น า มาพอ;ออ อนนา น ย อ มมา;บ อนมมา ท ด า;อด น มา า อ บา ดทา อ อ น ท อ เทย;นเดอน น;นาดย อมน อการ า ท;อ เดย;นภาพเดย;คุณสนั่น;คุณสนั่น;คุณสนั่น;คุณสนั่น;ทย์สม สุจีรา;ศ.ดร.เกรียงศักดิ์ เจริญวงศ์ศักดิ์;ศาสตราจารย์ ดร.เกรียงศักดิ์เจริญวงศ์ศักดิ์;โควต 19;ภิญโญ ไตรสุริย;สุขใจ ว่องไวศิริวัฒน์;นัฐพงษ์ เจริญอาภา;คุณพัชร;นันท์;คุณพัชรนันท์;คุณพัชรนันท์ เลิศพัชรีไชย;คุณพัชรนันท์;คุณพัชรนันท์;คุณพัชรนันท์;คุณรัมย์ เสาวภาคย์พงษ์;คุณรัมย์;เลอเพชร วิลล่า;คุณพัชรนันท์;คุณพัชรนันท์;คุณรัมย์;เลอเพชร;คุณรัมย์;คุณรัมย์;คุณรัมย์;คุณรัมย์;คุณรัมย์;ทวาราวดี;พระพุทธทวารวดีศรีปราจีน;ศุกพิณรัศ วงศ์สินศิริกุล วิริยะ ดำรงค์ศิริอภิชญา;นายLe;คุณพัชรนันท์ เลิศพัชรีไชย;คุณกุลยา ตันติเตมิท;คุณกุล;ดร.สุทธิพล ทวีชัย;ดร.สุทธิพล ทวีชัยการ;ดร.สุทธิพล;ดร.สุทธิพล;ดร.สุทธิพล;ดร.สุทธิพล;ดร.สุทธิพล;พระสยาม;Bill Molison;คุณวรวัฒน์;คุณวรวัฒน์;โตโน่ ภาคิน คำวิลัยศักดิ์;ผศ. ดร.ปริญญา;ยังมีเทวานฤมิตรกุล;คุณวรวัฒน์;ฟูดส์;นิธิฟูดส์;สมคิด พุทธศรี;คุณสุพริศร์;ดร.ธนิสา ทวิชศรี;ดร.ฐิติ ทศบา;ดร.อาชว์ ปวีณวัฒน;ดร.โสมรัศม์ จันทรัตน์;ดร.กฤษฎีเลิศสัมพันธารักษ์;ตร.วิโรจน์;ดร.วิโรจน์;ดร.วิโรจน์;วิโรจน์ จิรพัฒนกุล;จิรพัฒนกุล;ผศ. ดร.ธรณ์ ธำรงนาวาสวัสดิ์;ดร.ศุภชัย;คุณศุภชัย;ดร.ศุภชัย;คุณศุภชัย;คุณศุภชัย;ดร.ศุภชัย;ดร.ศุภชัย;คุณศุภชัย	PERSON
2022	คุณดนุชา;คุณดนุชา;คุณดนุชา;ปานชนก;Tea Club;นีล สตีเฟนสัน;มาร์ก ซักเคอร์เบิร์ก	PERSON
2012	จีน;ประเทศญี่ปุ่น;เมืองไครสต์เชิร์ช;ประเทศนิวซีแลนด์;ไทย;สหรัฐอเมริกา;รัฐมิสซูรี;สหรัฐอเมริกา;สหรัฐอเมริกา;รัฐควีนส์แลนด์;ประเทศออสเตรเลีย;นิวซีแลนด์;สหรัฐอเมริกา;ออสเตรเลีย;อุซเบกิสถาน;ซีเรีย;อิหร่าน;ปากีสถาน;บังกลาเทศ;กรุงเทพฯ;อิหร่าน;อุซเบกิสถาน;ปากีสถาน;ซีเรีย;บังกลาเทศ;เวียดนาม;เวียดนาม;ท่าอากาศยานนานาชาติอินชอน;ประเทศเกาหลีใต้;ท่าอากาศยานสุวรรณภูมิ;ไทย;ทวีปเอเชีย;อาเซียน;ท่าอากาศยานชางงี;ประเทศสิงคโปร์;ท่าอากาศยานนานาชาติกัวลาลัมเปอร์;ประเทศมาเลเซีย;Iมชิญ;กรีซ;กรีซ;กรีซ;กรีซ;ยุโรป;ยุโรป;เอเชีย;เอเชีย;เจริญกรุง;ประเทศไทย;เอเชีย;ประเทศไทย;เอเชีย;เอเชีย;ยุโรป;อเมริกา;เอเชีย;ไทย;สหรัฐอเมริกา;จีน;ไทย;จีน;เกาหลีใต้;อินโดนีเซีย;เกาหลีเหนือ;โคลอมเบีย;เกาหลีใต้;เกาหลีเหนือ;เมืองจีน;สหรัฐฯ;สหรัฐอเมริกา;สหรัฐฯ;สหรัฐฯ;อัฟกานิสถาน;จีน;แคว้นเวลส์;สหราชอาณาจักร;ออสเตรเลีย;เมืองโคตร;ไทย;จีน;มองโกเลีย;ยุโรป;สหรัฐอเมริกา;ยุโรป;ประเทศกรีซ;สเปน;อิตาลี;สเปน;อิตาลี;อาเซียน;สิงคโปร์;มาเลเซีย;ไทย;ยุโรป;กรุงเทพฯ;กรุงเทพฯ;ประเทศอังกฤษ;ประเทศอินเดีย;ประเทศบราซิล;วอชิงตัน ดี.ซี.;สหรัฐอเมริกา;เซี่ยงไฮ้;ประเทศจีน;อาเซียน;ไทย;ประเทศเวียดนาม;ไทย;Check-ins;Check-ins83,335Social Mediaยูเนี่ยนมอลล์Check-ins111,659เดอะมอลล์ บางกะปิ;สหรัฐฯ;ประเทศสหรัฐอเมริกา;สหรัฐฯ;สหรัฐฯ;สเปน;สเปน;ประเทศสเปน;สหรัฐฯ;ฝรั่งเศส;ฝรั่งเศส;ฝรั่งเศส;ฝรั่งเศส;ฝรั่งเศส;ยุโรป;ฝรั่งเศส;ฝรั่งเศส;ญี่ปุ่น;ญี่ปุ่น;สหรัฐฯ;เอเชียตะวันออกเฉียงใต้;ประเทศอินโดนีเซีย;เอเชีย;ประเทศไทย;ฟิลิปปินส์;ไทย;มาเลเซีย;กรุงพนมเปญ;เอเชียตะวันออกเฉียงใต้;ฟิลิปปินส์	LOCATION
2013	สหรัฐฯ;สหรัฐฯ;สหรัฐฯ;สหรัฐอเมริกา;สหรัฐฯ;สหรัฐอเมริกา;สหรัฐฯ;สหรัฐฯ;จีน;จีน;จีน;จีน;จีน;เกาหลีใต้;เกาหลีใต้;เกาหลีใต้;เกาหลีใต้;เกาหลีเหนือ;ไทย;ไทย;ไทย;ไทย;ประเทศไทย;อาเซียน;อาเซียน;ไทย;ญี่ปุ่น;เกาหลีใต้;อเมริกัน;สหรัฐฯษ41;จังหวัดนครนายก;ไต้หวัน;เกาหลี;มาเลเซีย;มาเลเซีย;มาเลเซีย;ประเทศไทย;กัมพูชา;อินเดีย;ศรีลังกา;ประเทศไทย;ประเทศเกาหลี;ไทย;เอเชีย;จีนตอนใต้;เมียนมาร์;ไทย;ลาว;เขมร;เวียดนาม;เกาหลี;ไต้หวัน;ออสเตรเลีย;นิวซีแลนด์;สหรัฐอเมริกา;ยุโรป;ญี่ปุ่น;ไทย;ไทย;สิงคโปร์;OffshoreBanking;ประเทศยุโรป;เอเชีย;เอเชีย;สิงคโปร์;สวิตเซอร์แลนด์;สิงคโปร์;สวิตเซอร์แลนด์;สิงคโปร์;สหรัฐฯ;สวิตเซอร์แลนด์;กรุงเทพฯ;กรุงเทพฯ;กรุงเทพมหานคร;กรุงลอนดอน;เมืองไทย;เอเชีย;ทวีปเอเชีย;กรุงเทพฯ;กรุงลอนดอน;กรุงปารีส;สิงคโปร์;นิวยอร์ก;เอเชีย;เอเชีย;เอเชีย;จีน;ฮ่องกง;ไต้หวัน;เกาหลีใต้;สิงคโปร์;มาเลเซีย;อินโดนีเซีย;ไทย;ฟิลิปปินส์;อินเดีย;อินเดีย;เกาหลีใต้;อินโดนีเซีย;ไต้หวัน;สหรัฐอเมริกา;มาเลเซีย;สิงคโปร์;ฮ่องกง;ฟิลิปปินส์;สหรัฐอเมริกา;สหรัฐอเมริกา;สิงคโปร์;ฮ่องกง;เกาหลีใต้;ไต้หวัน;มาเลเซีย;ไทย;จีน;อินโดนีเซีย;ฟิลิปปินส์;อินเดีย;ไทย;แคนาดา;จีน;สหรัฐอเมริกา;ญี่ปุ่น;เยอรมนี;เกาหลีใต้;อินเดีย;เม็กซิโก;แคนาดา;ไทย;Automotiveอินโดนีเซีย;ญี่ปุ่น;เอเชียตะวันออก;แปซิฟิก;ยุโรป;เวียดนาม;เอเชีย;เมียนมาร์;สหรัฐอเมริกา;ไทย;มาเลเซีย;เกาหลีใต้;เอเชีย;กัมพูชา;ลาว;ญี่ปุ่น;ญี่ปุ่น;ญี่ปุ่น;ไทย;ญี่ปุ่น;ญี่ปุ่น;ญี่ปุ่น;ไทย;ญี่ปุ่น;มาเลเซีย;เวียดนาม;ฟิลิปปินส์;อินโดนีเซีย;พัทยา;บางเสร่;พัทยา;พม่า;ไทย;สิงคโปร์;กรุงเทพฯ;กรุงเทพฯ;กรุงเทพฯ;กรุงเทพฯ;ท่าอากาศยานสุวรรณภูมิ;สยามพารากอน;กรุงเทพฯ;ไทย;เกาหลีใต้;จีน;อาเซียน;เอเชียตะวันออก;ประเทศอังกฤษ;เอเชียใต้;แอฟริกา;บังกลาเทศ;เนปาล;ปากีสถาน;คองโก;เอธิโอเปีย;ซูดาน;ซูดานใต้;ยูกันดา;ไนจีเรีย;สหราชอาณาจักร;สหราชอาณาจักร;สกอตแลนด์;สหราชอาณาจักร;สกอตแลนด์;สหราชอาณาจักร	LOCATION
2014	อินโดนีเซีย;ฟิลิปปินส์;ญี่ปุ่น;เมืองลาสเวกัส;สหรัฐอเมริกา;สหรัฐฯ;สหรัฐอเมริกา;สหรัฐอเมริกา;ขั้วโลกเหนือ;มาเลเซีย;สเปน;โคลอมเบีย;เม็กซิโก;มอลตา;อุรุกวัย;ไทย;ไทย;สหรัฐฯ;สหรัฐฯ;สหรัฐฯ;ยุโรป;ญี่ปุ่น;ไทย;ไทย;สหรัฐฯ;สิงคโปร์;ยุโรป;สหรัฐอเมริกา;อาเซียน;อินโดนีเซีย;อาเซียน;มาเลเซีย;ไทย;สิงคโปร์;สิงคโปร์;สิงคโปร์;สิงคโปร์;กรุงปารีส;ประเทศฝรั่งเศส;กรุงออสโล;ประเทศนอร์เวย์;นครซูริก;ประเทศสวิตเซอร์แลนด์;นครซิดนีย์;ประเทศ;ออสเตรเลีย;กรุงการากัส;ประเทศเวเนซูเอลา;กรุงเจนีวา;ประเทศสวิตเซอร์แลนด์;นครเมลเบิร์น;ประเทศออสเตรเลีย;กรุงโตเกียว;ประเทศญี่ปุ่น;กรุงโคเปนเฮเกน;ประเทศเดนมาร์ก;เกาะเต่า;จังหวัดกระบี่;จังหวัดภูเก็ต;เอเชีย;จังหวัดกาญจนบุรี;ไทย;ประเทศไทย;อาเซียน;อเมริกา;อินโดนีเซีย;ไทย;สิงคโปร์;มาเลเซีย;อินโดนีเซีย;เมียนมาร์;บรูไน;เวียดนาม;กัมพูชา;ลาว;ฟิลิปปินส์;ประเทศไทย;นครราชสีมา;กรุงเท;สมุทรปราการ;ขอนแก่น;อุบลราชธานี;ไทย;เดนมาร์ก;โตเกียว;ยโสธร;สุรินทร์;นครพนม;นอร์เวย์;สวิตเซอร์แลนด์;ไทย;สมุทรสงคราม;ปัตตานี;เนเธอร์แลนด์;ประเทศไทย;อาเซียน;สิงคโปร์;ไทย;ไทย;สหรัฐฯ;ไทย;สหรัฐฯ;ญี่ปุ่น;สหรัฐอเมริกา;สหรัฐอาหรับเอมิเรตส์;มาเลเซีย;ฮ่องกง;ญี่ปุ่น;อินโดนีเซีย;จีน;จีน;จีน;จีน;จีน;จีน;จีน;จีน;จีน;จีน;จีน;จีน;จีน;จีน;จีน;จีน;จีน;จีน;จีน;จีน;จีน;จีน;จีน;ประเทศจีน;จีน;จีน;จีน;จีน;จีน;จีน;จีน;นครปักกิ่ง	LOCATION
2016	YunnanCHINA;แม่น้ำโขง;กัมพูชา;ลาว;เวียดนาม;จีน;ไทย;ด่านแม่สอด;จ.ตาก;ไทย;ชายแดนจีน;ลาว;ด่านเชียงแสน;จังหวัดเชียงราย;เมืองมัณฑะเลย์;เมืองตองยี;แม่ฮ่องสอน;ด่านแม่สะเรียง;จังหวัดเชียงราย;บ้านห้วยต้นนุ่น;บ้านห้วยผึ้ง;จังหวัดแม่ฮ่องสอน;จังหวัดเชียงใหม่;ด่านเชียงของ;จังหวัดเชียงราย;ด่านทุ่งช้าง;แม่น้ำโขง;สปป.ลาว;จังหวัดน่าน;ภาคเหนือ;จังหวัดเชียงใหม่;อาเซียน;กิ่วผาวอก;อำเภอเชียงดาว;ภาคเหนือ;แม่น้ำโขงตอนล่าง;เมียนมา;ด่านแม่สอด;จังหวัดตาก	LOCATION
